{
	"$schema": "../models_schema/root.json",
	"type": "JSON",
	"multi": false,
	"path": ["RP/entity/**/*.json"],
	"json_path": [],
	"pack_type": "resource-pack",
	"identifier":  {
		"json-path-value": {
			"path": ["minecraft:client_entity", "description", "identifier"],
			"path_start": "file"
		}
	},
	"properties": {
		"particle_effects": {
			"alias_mapping": {
				"referenced_object": "particle",
				"access_paths": [
					{
						"multi": true,
						"path_start": "object",
						"path": ["minecraft:client_entity", "description", "particle_effects", "@STR"]
					}
				]
			}
		},
		"particle_emitters": {
			"alias_mapping": {
				"referenced_object": "particle",
				"access_paths": [
					{
						"multi": true,
						"path_start": "object",
						"path": ["minecraft:client_entity", "description", "particle_emitters", "@STR"]
					}
				]
			}
		},
		"sound_effects": {
			"alias_mapping": {
				"referenced_object": "sound_definition",
				"access_paths": [
					{
						"multi": true,
						"path_start": "object",
						"path": ["minecraft:client_entity", "description", "sound_effect", "@STR"]
					}
				]
			}
		},
		"animations": {
			"alias_mapping": {
				"referenced_object": "client_animation",
				"access_paths": [
					{
						"multi": true,
						"value_processing": {
							"filters": {
								"exclude": false,
								"items": [{"starts_with": "animation."}]
							}
						},
						"path_start": "object",
						"path": ["minecraft:client_entity", "description", "animations", "@STR"]
					}
				]
			}
		},
		"animation_controllers": {
			"alias_mapping": {
				"referenced_object": "client_animation_controller",
				"access_paths": [
					{
						"multi": true,
						"value_processing": {
							"filters": {
								"exclude": false,
								"items": [{"starts_with": "controller.animation."}]
							}
						},
						"path_start": "object",
						"path": ["minecraft:client_entity", "description", "animations"]
					}
				]
			}
		}
	}
}